Her Uncle Stay At Side At Magwegwe And His Only Left He Is Also Old^,1
Here I Can Get Work Opportunities^,1
To Live With Childhood  Neighbours ^,1
I Am Able To Do So Many Businesses In This Area^,1
Because I Belong Here I Have No Other Place^,1
L Love The Place Because Is Very Safe Unlike Diepsloot^,1
Because I Originate From Zimbambwe^,1
It'S Where I Come From And Feel At Home^,1
The Place Is Appealing To Me~It'S Where People With Money Stays And I Hope In 10 Years Time I Would Have Money^,1
I Like The Invironment^,1
My Family Is Back Home And My Brothers Children Are There So I Need To Go Back When I'M Old^,1
My Parents Let Me A Home Soninwill Retirecthete I'M Building It As Renovating It Now^,1
If I Feel Sick~ I Have Someone To Take Care Of Me^,1
To Guard My House And Also Plant And My Kids Will Be There One Working^,1
Life Is Less Expensive^~You Get Basic Needs Like Water For Free^,1
Family And Friends Are Based There^,1
The Life Here Is Faster Than The Rural Areas^,1
It'S A Serene Place To Live^,1
* Hope To Build A House There Someday ^,1
Dubai'S Population Is Lower And Life Expectancy Is Higher Than In Than ^,1
The Respondent Is Still In School So She Hasn'T Thought About Retirement^,1
I Wish I Can Be Accepted At Cape Town University And The I Will Move There^,1
Services Are Close By And The Scenery Is Appealing~And There Is A Nice View^,1
When You Get Old~ You Don'T Enjoy Being In The City.^,1
Very Classy Place And I Very Very Safe~I'M Hoping With The Money I'M Saving And When. Complete My Studies Will Be Able To Afford A Place In Houghton^,1
Place Of Origin^,1
Going Back Home Is Not An Option Economy Wise^,1
It'S Home Where My Family Is^,1
It'S My Mother'S Hometown And I Like The Place^,1
Part Of My Family Is There And There Is Good Social Policies For The Aged ^,1
Because My Family Is In Parkistan In Need To Be With Them.^,1
I Want To Buried Home And Take Care Of My Grand Children^,1
That'S My Place Of Origin L Will Like To Be Buried Home^,1
Access To Land^,1
It Is The Best Place To Rest When I'M Old And Not Working.^~I Will Be Close To My Family Who Will Help Me^,1
I Am Still Aspiring To Continue My Education So I Have Not Concluded Where I Want To Retire In Future ^,1
That'S Where My Heart Is^,1
I Was Born Here So Don'T Feel Comfortable Moving^,1
I Only Came Here To Help My Brother With His Business And Make Enough Money But Ethiopia Is My Home And Where There Is Too Much Crime And Xhenopobia^,1
I Want To Relax In A Place Where I Grew Up^,1
That'S Where My Family Is^,1
I Intend To Build A Retirement House There So I'Ll Live There^,1
No Place Like Home^,1
That Is What Is Done In My Culture ^,1
Close To Family ^,1
Due To The Temperature At My Community Of Origin. It Is Very Conducive ^,1
Because  The Place  Is Peaceful ^,1
The Are Better Opportunities Here In South Africa Than Mozambique So He Will Means To Move His Family This Side.^,1
Go Back To Bolawayo^,1
My Investments Are All The (House And Family)^,1
Less Cost Of Living^,1
I Have My Own Business That I'M Running^,1
It'S A Cool And Collected Area^,1
I See It As The Best Place^,1
I Love My Home^,1
Because It Is A Quiet Place^,1
It Is My Hometown And Now That Mugabe Is No More It'S A Different Country...It'S Peaceful^,1
East Legon Is More Formal~ Respected And Rich Neighbourhood^,1
Because I Didn'T Get A Chance To Grow Up In Mozambique^,1
Because I Love The View^,1
Back Home Where I Feel I Belong^,1
Just Want To Start A New Life There^,1
Here At Diepsloot~I Have Registered For A Rdp House As For Now The Rent Is Very Cheap ^,1
I Came Here For Work Only Not Stay Forever^,1
Johannesburg The Lifevherecisbtoo Fast And Dangerous~So T Home I Have A House And It'S Safe And The Life Is Not That Expensive^,1
I Would Live A Better Life Than Here In Diepsloot^,1
My Country Of Origin^,1
It Is Quiet Place^,1
I'Ll Be Safe At Home Than Here^,1
I Came To Johannesburg To Work^,1
I Always Wanted To Stay There^,1
Life Style^,1
Because It'S Not A Crowded Place... People Treat Each Other Nicely^,1
Because I Originate There Is My Home Country^,1
Because My Family Bought A House There So If I Will Be Not In My House I Will Move There^,1
I Am Struggling To Get A House Here Because My Passport Has Expired And It'S Better When I'M Old To Go Back Home And Stay At My Grandparents Home^,1
It'S Home~ Where I Was Born And Where My Ancestors Are.^,1
It Is Quiet And Peaceful.It Is A Nice Place To Relax In^,1
New Place~ New Environment^,1
Everything Is Free That Side~ In The City You Have To Buy Everything^,1
Because I Don'T Know If My Family In Lethabong They Still Exist (Father)^,1
I Came To Johannesburg To Improve My Life Or Should I Say Uplifting Then Once I'M Done I'M Heading Back To Shokwe To Start My Own Business^,1
I Have A Home There And I Want To Retire There^,1
A Person Can Not Retire Here In Johannesburg~ We Need To Get Back Home^,1
I Want To Be Closer To The City^,1
Life Is Better And Good There^,1
That'S Where I Wanna Relax At^,1
I Originate There In Venda And I Truly Love The Place^,1
That'S Where My Family Is ^,1
The Area Is Peaceful And Safe ^,1
Is My Origin I Want To Buried Home^,1
Because I'M Not A South African Citizen^,1
Going Back Home To Spend Her Money With Her Children.^,1
She Said She Came Here To Stay With Her Husband But Theyoth Planning To Move Backed To Barbarton Together.^,1
Because My Family Will Look After Me There^,1
Imy Child And Family Home Is There~And Whilst I'M Working Herec I'M Building At Home For Future^,1
Life It'S Very Difficult At Home~Am Not Planning To Go Back^,1
I Like The Place^,1
I'M Building There^,1
That'S My Place Of Birth And I Still Have My Family There^,1
Finished Her Llb And Enjoying Her Benefits With Her Family.^,1
That'S Where My Family Is And They Will Help  Me When I'M Old^,1
Stay Close To My Future Farms Where I Can Enjoy Nature^,1
Since Her Husband Is The One Making Money This Side They Both Planning To Buy A House And Retired In Port-Shepstone And Rent Their House In Berea.^,1
East Legon Is Quiet And Serene^,1
No One Bothers Me Here^,1
That Is My Birth Place And My Family Lives There ^,1
I Like To Stay Here^,1
Access To Social Amenities ^,1
Life Is Comfortable Here And This Is Where I Was Born.^,1
My Household Would Relocate There Soon^,1
It Is Ga Village And I Hope To Build My House There Where I'Ll Live When I Retire ^,1
I Dont Know Where Else Apart From This Place^,1
My Family Stays There ^,1
It Is My House^,1
That Is My Hometown And My Place Of Birth With Majority Of My Family Living There ^,1
The Place Is Neat And Quiet ^,1
So That  I Can Advise The Younger  Generation ^,1
Stay With My Family^,1
To Enjoy In My Own House^~It'S Peaceful Also^,1
It Is Peaceful^~No Crime Compared To Diepsloot^,1
Stay Here In Diepsloot Forever Business Is Growing.^,1
Her Mother Have Livestock^,1
It'S My Home Town^,1
There Are Many Resources Here Around Johannesburg~So I Want My Kids To Be Where There Are Many Opportunities^,1
I Love The Place~It Has Piece Of Mind And A Very Private Life^,1
It'S A Quite Place Away From Family And Friends ^,1
I Want To Build And Settle With My Family When I Marry^,1
It'S  A Quite Place To Stay^,1
Access To Wife And Children ^,1
I Would Love To Buy A House There^,1
That Is The Place I Will Like To Rest^,1
Due To It'S Serene Place ^,1
I Have Not Been To Any Place Before.^,1
I Hope To Build A  House There ^,1
My Parents Come From There (Tamale) (Even Though I Am Born In Old Fadama)^,1
Take  Care Of My Aged Mother If She Is Alive^,1
To Be With My Family. ^,1
Because It'S Where The Respondent Grew Up He Doesn'T Wish To Move Anywhere Else^,1
I Want To Be Free^,1
Because It'S Home Where My Family Is And Everyone That I Love^,1
It'S Home Where I Left My Family^,1
Because Is The Place I Love ^,1
The Place  I Will Get Married  To^,1
Have Peace^,1
Where I Love To Spend The Rest Of My Life^,1
I Just Want To Relax And Rest^,1
Because I Like This Place^,1
It Is Peaceful^,1
Home Is Always The Best.^,1
Because I'M Used To The Place^,1
The Best Place To Be In After Retiring ^,1
Tht Is My Home ^,1
It Is My Community Of Origin~Peaceful And I'Ll Be With My Family. ^,1
Maybe When I Get Old I Can Go To Eastern Cape^,1
It'S A Cool Place To Ritire Plus The Is Agriculture^,1
To Have A Good Time ^,1
Access To Educational Resources ^~Access To Economic Resources ^,1
No^,1
There Is No Place Like Home ^,1
This Is Where I Can Afford To Rent ^,1
It'S Where I Get My Daily Bread~Rent And School Fee For My Children^,1
I Consider This Place Home^,1
It'S Peaceful~ You Just Think About Your Plants That All~ No Stress^,1
Have My Family Hereenglish^,1
I Was Born Here^,1
I'M Now Used To The Lifestyle And Everything Else^,1
Here In Gauteng^,1
I Would Have Put Away Enough Money To Stay Home~And At Maputo It'S Very Nice And I Will Be With Other People Of My Neighborhood^,1
I'Ve Always Wanted To Go To The Surbubs^,1
It'S A Informal Settlement But I Believe It'S Gonna Improve When Time Goes On^,1
My Culture And Roots Are In Ulundi^,1
The Place Is Peacfull^,1
My Family Is Based Here^,1
Peace ^,1
Go Back Home Eventually ^,1
A Place That I Know Most ^,1
I Don'T Want To Start From Scratch^,1
Spend Savings And Relax In Old Age^,1
It'S  A Quite Place  To Retire  And  Live Peacefully^,1
Its Where I See My Family And I Happy ^,1
It Is Close To The Sea^,1
She Has Lived Here Since She Was Born.^,1
She Likes To Stay In Her Neighborhood Because She Grew Up Here.^,1
Ruaka Is Next To Town.^,1
I Am Very Comfortable With This Place^,1
Have Property Such As Land^,1
I Can Move Just For Beltter Employment Opportunities^,1
Where She Is Because Is Where She Grew Up And Is Used To Being Here( Katlehong)^,1
Where I'M Staying In Katlehong It'S Very Quite And No Problems Too Much~And The Stores Are Close By^,1
No Desire To Move Because Of Old Age^,1
I Like My My Home^,1
There Are Lots Of Opportunities Here^,1
The Space Is Enough^,1
Family Is There^,1
Businesses Are Well Doing^,1
My Marital Home To Take Care Of Mh Farm And Home ^,1
It Is Where My Family Members Are.^,1
That'S  Where Am Married^,1
Many Opportunities For Life. Housing. Business^,1
The Country Is Very Peaceful ^,1
Home Town^,1
Don'T  Know  Where To Leave So Long I Have Peace^,1
It'S  More Peaceful Than My Country Of Origin. Tranquillity  Is Everything For Us^,1
That Is Where I Come From^,1
Because It Is Peaceful ^,1
To Go Live Or Finish My Life Time In The Village ^,1
Get Married To A Kenyan Because Kenya Is Peaceful ^,1
No Any Other Reasons ^,1
Home Area And Can Open His Line Of Job And At The Same Time Do Farming^,1
Its Peaceful ^,1
The Land There Is Arable And I Would Like To Practice Farming On My Retirement.^,1
No Expenses And I'Ll Be With All My Family Members ^,1
She Is Married In That Place ^,1
Here Where He Is Staying Now Because He Stays With His Loved Ones Here^,1
Don'T Have One^,1
That'S My  Community Of Origin And Is Very Accommodating As A Result Of The Tourist Attraction ^,1
Vacation And Rest^,1
It'S  Free Area And Awah From  The Kayole Congestion ^,1
To Be With My In-Laws^,1
That Is My Country^,1
My Children Are Still Here^,1
Because I Have A Plote Of Land There ^,1
A Nice Place^,1
Access To Family Members^,1
It Is My Home Town^,1
I Have My Own Property There^,1
That'S Where My House Is.^,1
It'S My Home~ I Don'T Want To Be Infected With Covid 19 In Other Places^,1
My Family Lives There^,1
Closer To Loved Ones^,1
Still Young Not Sure Where He Woul Retire To^,1
Wants To Be Home Near Loved Ones^,1
I Have A Job Here And Life Is Affordable ^,1
I Have My Family And Friends There^,1
I Wish To Go There For Good^,1
There'S Peace Of Mind^,1
That'S My Place Of Birth^,1
To Grow Old Where Family Is^,1
Life Its Easy In Community ^,1
That Is Where I Have Our Land^,1
To Care Of His Herd Of Cattle ^,1
Getting Employment^,1
My Family~ Properties And Businesses Would Be There ^,1
It Is A Peaceful  Place^,1
My Childhood Friends Are There^,1
I Grew Up There ^~Things Are Cheaper There^,1
Because Itis My Country  Of Birth^,1
It Is Calm And That Is My Home Country ^,1
A Fast Developing Area^,1
James Town Is The Place I Have Lived All My Life And Have My Fans Friends There Too^,1
I Feel This Is My Home^,1
Because Of The Care Available  Here^,1
Be With My Extended Family ^,1
Because I Belong There^,1
I Like To Be Buried Where I Originate^,1
Because It'S At The Outcast Of Nairobi ^,1
That Place Is A Better Place Full Of Good And Cool Environment ~Plus It Is A Peaceful  Place To End My Life Time In.^,1
Because I'M Used In This Place^,1
More Peaceful ^,1
Life Is Affordable ^,1
Kayole Is Overcrowded ^,1
Land There Are Sold Cheaply^,1
Less Expenses ^,1
Just To Be At Home With My Grandchildren ^,1
It'S  Where I Will Be Interred ^,1
It'S  An Upmarket Area With Little Noise And Serene For The Old.^,1
Housing And Environment Are Good^,1
It Has Lots Of Free Land^,1
Is Good To Invest Near Home Because You Can Monitor Your Work While At Home^,1
Stay With My Husband ^,1
Presence Of  Family Members ^,1
That'S My Place Of Abode ^,1
I Have Lived Here My Whole Life^,1
Has Better Services^,1
Continue With Business^,1
It Has People Who Are Focused^,1
Its Where Am Used To^,1
I Tried Another Life Here In Gauteng But Will Retire Back Home^,1
It Is A Very Quite And Nice Place~If My Business Picked Up Early In Life I Would Have Saved And Moved With My Family~Nice Place For Children To See Another World And I Love Portuguese^,1
It Is Quiet^,1
I Have My Own House Here^,1
To Do Farming And Business Aroundmy Place^,1
Because  Its Home Place ^,1
Nowhere Else I Can Go^,1
I Have School Going Children ^,1
Plans To Buy A Plot And Build A House There ^,1
It Is Refreshing To Retire To A Place You Know^,1
I Like The Place I Grew Up In^,1
Is My Home Town And A Nice Place For Doing Business ^,1
It Is A Peaceful Place To Rest In Compared To This Noisy Place^,1
Home Is Always  The Best~ I Came To The City For Economic Reasons ^,1
To Be Close To Relatives^,1
Life Is Less Expensive There^~My Family Is There^,1
Its A Good  Cool Place ^,1
Here There Is Crime E And Discrimination^,1
Its My Ancestral Home.^,1
To Develop The Area^,1
Away From The City  And Calm^,1
Have Land And Life Is Cheap^,1
That'S Where I Was Born And Raised^,1
The Place Is Peaceful.^,1
The Is Good Business Where I M And The Neighborhood Is Key^,1
The Environment  Its Good^,1
Settling Down To Raise Grandchildren^,1
Originate Form That Area^,1
To Relax  With Family ^,1
Husband'S Wish^,1
It'S  Away From The Filthy Area That I Stay In Currently. ^,1
I Have No Reason ^,1
Grow Old With Family ^,1
For More Relaxed Life^,1
Is My Husband  Place^,1
Just Here^,1
Just For Business ^,1
My Husband'S Home Town ^,1
Look After And Take Care Of My Home And Husband ^,1
Peace^,1
I Have Bond With Theplace I Come From^,1
He Will Build A Home There^,1
That Is My Place Of Birth^,1
Majority Of My Family Members Live There^,1
Home.Life Is Cheaper ^,1
A Friend Lives There And Has Described It To Me. It Sounds  Very Appealing. ^,1
Just My Community Origin No Other Place^,1
My Ancestral Land^,1
It'S My Place Of Birth And Haven'T Known  Anywhere Apart From Where I Stayed With My Late Husband  In Nakuru^,1
Stay Near My Family^,1
Lack Of Opportunity To Go Somewhere Else ^,1
A Cool Place With Good Environment^,1
She Comes From That Area ^,1
My Matrimonial Land ^,1
Its The Only Home I Know As At Now. ^,1
Home Of Origin ^,1
I Am Not A Young Man Any ^,1
My Home Country City^,1
I Want To Be Buried There^~I Want To Start A Farm There^,1
Cool And Serene^,1
To Build A Home^,1
Retire Near Patents ^,1
N/A^,1
Home County ^,1
My House Is There ^,1
That Is Where I Come From And My Family Is There ^,1
It Is A Peaceful Area And Close To My Family Members ^,1
Where I Will Get Married Is Where I Will Stay When I Retire ^,1
I Have Lived There All My Life ^,1
Urban Life Is Great ^,1
Dream Place ^,1
It Has Good Has Prime Plots And Fertile Land^,1
The Culture ^,1
My Father'S Land ^,1
Back Home^,1
Life Is Abit Cheaper Home. Less Expenses. ^,1
That'S Where I Was Born And Brought Up^~My Relatives Are There ^,1
I Like Kenya ^,1
No Expenses And I'Ll Be With All My Family Members. ^,1
To Get Rest ^,1
This Is My Home.^,1
Calming Place To Be^,1
Has A Fertile Land That Supports  Agriculture~ More So Maize  Farming ^,1
Qiute And Peaceful ^,1
Home Is Home. One Must Go Back^,1
Very Wonderful ^,1
My Home Peace Of Mind^,1
Plenty Of Land^,1
Change Of Environment  Since I Was Born~ Raised~ Schooled  And Married In The Area Of Interview. ^,1
Because Mum And Siblings Are There ^,1
My Dream Destination ^,1
Is My Ancestral Home ^,1
It'S My Husband'S Ancestral  Land. ^,1
For Peace Of Mind ^,1
It Has More Opportunities  For Business^,1
I Want To Be Involved In Politics In My Community ^,1
Because Is The Region I Belong To ^,1
Because There Is Freedom ^,1
Has Many Places Someone Can Have Fun ^,1
Bought Land There^,1
Where My Home Is^,1
This Place Has Become My Home Its All I Know.^,1
Doesnt Want To Leave^,1
Im Used To My Place Of Resistance Here In Kayole^,1
Because Of His Age.He'Ll Be Older By Then. ^,1
There Is No Other Place To Be Rather Than Go Back Home^,1
It Is Peaceful And There Are No Expenses Since It Is Home.^,1
Home Is Always  Home.^,1
It'S  A Serene Place~ And Have Always Love How Fast It Develops.^,1
Hillbrow^,1
We'Re The Whole Family Are Staying.^,1
Because It'S Home Of Origin^,1
Because There Are More Opportunities^,1
Its My Birth Place^,1
No Noise^~No Crime^,1
Most Of My Families And Childhood Friends Lived There ^,1
I Am Old I Can'T Start Life Elsewhere Now ^,1
Start A Family^,1
My Home Place ^,1
The Environmental Is Good And Boarders Lakes And Parks ^,1
I Have Friends And Relatives And Life Is Better There.^,1
My Home Town With My Farm^,1
Because That Is Where Family Lives ^,1
Nice Scenary^,1
It'S In The Rural Area~ More Fresh Air^,1
My Motherland Ancestral City^,1
This Place Iam Now Is More Secured Than My Home Country^,1
Have A Family In Canada^,1
I Have Not Plan For It Yet^,1
It'S Where I Come From^,1
Kenya Is A Good Country With Many Opportunities ^,1
Its My Dream Country ^,1
By That Time~ We Would Have Stayed Here For Long And Would Have Many Property And Friends Here^,1
Plan To Build A House There^,1
Proximity To City~ Quietness Of Community And Amenities ^,1
To Take Care Of My Farm And Home ^,1
To Relax At Home ^,1
To Join The Husband^,1
Peaceful And Less Expenses ^,1
It Is More Peaceful Than Where I Came From^,1
Have A Home At Rinya Awendo^,1
Marriage ^,1
This Is Home This Is All I Know.^,1
That'S  Where Have Bought Land.^,1
It Is My Ancestral Home^,1
No Where^,1
Its Home ^,1
Economy Is Booming And Thats My Home Country^,1
I Have Been Here For More Than 5 Years And I Can Now Call It Home.^,1
To Spend Time With Husband ^,1
00^,1
To Help The Community ^,1
It'S Where I Was Born^,1
It Is Where I Was Born.My Place Of Origin^,1
Since I Would  Be A Kenya Through  Naturalization  And I Will Retire  In Kenya ^,1
Where Am Married ^,1
It'S  My Home And I Only Came In The City Because  Of Economic Reasons.^,1
Ots My Ancestral Land^,1
Lesser Expenses And Peace Of Mind ^,1
Its A Nice  Place ^,1
To Stay With My Family In A Peaceful Environment With Less Expenses.^,1
Cost  Of Living  Is Low^,1
Economic Growth ^,1
It'S  Home~ And I Would  Love To Retire There After My Economic Advancing  Tour^,1
This Is Home^,1
It'S The Ancestral Land^,1
I Have Some Members Of Family There^,1
Life There Is Cheap^,1
I Feel  Embraced By The Locals And Hence I Can Call It Home^,1
Health Care Is Good^~Is Safe And Look After Old People^,1
My Husbands House^,1
Its My Home^,1
Its Where Am Married ^,1
Life Is Easier On Rent And Food^,1
At Old Age It Is Good To Go Home And Be Close To Family.^,1
It'S  Away From The City Filth~ Noise And Congestion. ^,1
This Town Is A Business Centre So I Would Like To Stay ^,1
Because It Is Home And We Just Left Because Of War And Violence ^,1
Where I'M Respected ^,1
More Opportunities For Work And Life Is Cheaper^,1
No War^,1
Join The Son In Australia^,1
It Is A Decent Place And Also In Accra^,1
Is My Home Area^,1
My Parents Country ^,1
It'S Within The Metropolitan Area And Also Fast Growing Town.^,1
Continue Farming^,1
Its A Peaceful Place ^,1
More Peaceful Here^,1
Monthy Stipend And Upkeep For Refugees^,1
Have A Home At Mibunda^,1
To Rest  For Farming ^,1
Its So Peaceful ^,1
It'S Peaceful As Compared To Where I Came From.^,1
Peaceful  Country^,1
It Is Cool And Nice.^,1
Because Home Is Nice^,1
Adenta Is Peaceful~ I Don'T Have Problem With Any Body So When I Gather Money I Will Bring My Wife And Children Here^,1
I Want To Own A Pre-School Here And We Have Land Here^,1
Getting Old Makes You Weaker And So Good To Be Home^,1
It Is My Place Of Origin ^~I Will Be Buried There When I Die9^,1
Family Members Are Always Available To Support You^,1
I Like The Area^,1
Access To Economic Resources ^~Access To City Life^~Access To Family And Friends ^,1
My Dream Country ^,1
More Respect And Peace Here Plus More Business Opportunities ^,1
That Is Where I Can Get The  Support  Of Family Members ^,1
I Have Land And A Whole Life Here^,1
It Is Easier To Progress Over There^,1
There Is A Plot Of Land I Have There^,1
I Want To Own A Farm There^,1
Peace Is All What I Need.^,1
Adabraka Is A Decent Neighbourhood And Ghana Is More Peaceful Than Nigeria^,1
Green Pasture ^,1
Madina Is A Formal Residential Area~ This Place Is Temporary^,1
Life Is Better^,1
I Will Be Close To My Family ^,1
Uk Is More Developed And Richer Than Ghana^,1
That Is Where I Come From. I Want To Die There^,1
That Place Is More Dignified Than Old Fadama^,1
Lived Here Most Part Of My Life ^,1
You Are Always Closer To Family And Friends Especially Those You Grew Up With ^,1
That'S My Home. There Is No Place Like Home^,1
It'S My Homeland  And All My Family  Members Are There^,1
That'S My Hometown. There Is No Place Like Home^,1
Love The  Environment ^,1
I Feel It'S Better To Go Out Of The City^,1
Due To The Geographical Nature Of The Place ^,1
Due To It Peaceful  Nature ^,1
This Is My Hometown And This Where I Have Built.^,1
Nana^,1
Comfortable  Environment ^,1
Want To Go And Be With My Family ^,1
The People From My Community  Of Origin Make Me Feel At Home Here In Ghana^,1
My Family Will Be There To Support Me^,1
Have Childre All My Children May Grow Up Here^,1
Is My Home Place^,1
Its Always Been My Dream Since A Friend Described Brooklyn  To Me^,1
It Is A Peaceful Place ^,1
This Place Is Peaceful ^,1
Condusive Environment ^,1
It Is Peaceful And To Be With My Family. ^,1
It Has Space For Building And It'S A Spouting Town Within The Metropolitan. ^,1
Life Is More Meaningful There^,1
Due To The  Calm Nature Of The Place And Friendly People ^,1
Due To The Calm Nature Of The Environment ^,1
Due To The Serene Environment ^,1
The Place Is Nice ^~Respect For Those Who Stay There^,1
My My Dream ^,1
Want My Children To Grow Up There~ Daire^,1
To Have Inner Peace Without Family Pressures ^,1
France Has Depleted~ And Is Still Depleting The Resources Of Ivory Coast So If I Get The Opportunity~ I Will Retire There And Enjoy Some Of Our Resources That France Stole From Ivorians^,1
I Want To Be Close To My Mother If She Is Still Alive At That Time^,1
Place Less Noisy ^,1
It'S Less Noisy^,1
The Place Has Everything Good With Good Weather ^,1
Because  It Is A Peaceful  Area^,1
It Is A Place I Am Used To^,1
It'S Nice To Be At The Rural Area'S^,1
I Need To Meet New People Who Will Help Me As I'M Alone With No One To Help Me^,1
Is My Place Of Birth And Will Like To Be Buried There If I Die.^,1
My Most Family Is There^,1
It Is Where My Family Are.^,1
No Family In Hometown ^,1
It Has A Good Climatic Condition And Also Quite ^,1
It Is A Good Place To Rest^,1
I Won'T Stay In Shack Forever~And Sandton Is A Very Nice Place And Quiet^,1
I Feel Comfortable In Kenya.^,1
To Stay With My Family^,1
Has Known Rongai To Be Home^,1
It'S  Near A Lake And I Love Water.^,1
Where My Home Is ^,1
It Is Home Where I Was Born. To Be With My Family. ^,1
It'S Good To Retirec To Your Home Country^,1
Cantonments Is A Quiet And More Decent Neighbourhood^,1
It Is More Peaceful Here And Life Is A Little Bit Cheaper ^,1
Access To Better Education For Children ^,1
When You Try To Sell Something Or Start A Business~ People Support You^,1
My Son Likes It Here And I Want To Live Close To My Grand Children When I Am Old^,1
Access To Land For Farming ^,1
Its Home^,1
To Supervise My Businesses ^,1
My Family Is There^,1
To Know Their Culture And To Live There.^,1
It'S A Cool Place^,1
It'S Home ^,1
Nkandla^,1
It'S Where He Was Born And Raised~Used To The Surroundings And People^,1
Where I Originate^,1
Place Where I Belong Ad Where My Family Is^,1
That Is Where I Am Much  Familiar ^,1
To Take Care Of My Grand Children^,1
I Feel Is My Origin Because My Father Said I Belong There Even Though I Was Born Here^,1
That Is My Origin^,1
It Is M Original Country~A Zulu Man Have To Retire At Home^,1
Things Are Better Here Than In Bulayawo.^,1
This Neighbourhood  Is Very Peaceful ^,1
I Hope To Build My House There So Retire And Stay There With My Children ^,1
Spend Time With My Parents^,1
It'S Home Away From Home For Me~ Since I Was Born In Rongai. ^,1
Plans To Buy A Land There^,1
I Have Land And A House There^,1
Rural Life Is Cheap Than Urban Life^,1
Due To Family Relations^,1
Because That'S Where I Come From^,1
Due To The Economic Activities That Goes On There^,1
Korle-Bu Is A More Formal Neighbourhood^,1
I Would Have Built My House Here^,1
That'S Where My Family Is And They Will Give Me The Support I Need ^,1
My Partner And Children All Live Hereenglish^,1
I'M Farming In The Village ^,1
My Friends Are Here ^,1
Have To Go Back To My Country Of Birth^,1
My Ethnic Group Believes In Family System So Retiring At Such Community Will Help Me To Get Support ^,1
He Hasnt Thought Of That Because He Believes To Retire You Shoukd Be Working For A Government^,1
My Matrimonial Home ^,1
Husband Is Buying A Land There^,1
Have Built A Home There^,1
My Husbands Ancestral Home ^,1
Where I Will Have My Family ^,1
Life Is Fast Around Here^,1
