It'S  Closer To My Ancestral Place And I Would Still Get Opportunity To Easily Access Home.^,1
Good Place To Do Farming^,1
It'S My Country ^,1
Life Is Cheap And Very Few Bills^,1
The Place Is Cool And Peaceful For Resting. ^,1
Because There'S Plenty Of Food And Less Expenses ^,1
Because Most Of My Family Are Here^,1
There Are Lots Of Business Opportunities Here^,1
Is Not Overcrowded ^,1
Its A Good Place ^,1
The Town Is Good For Business ^,1
That Place Is More Decent^,1
My Whole Life Revolves Around This Place^,1
No Place Like  Home ^,1
I'M Respected ~ Loved And Supported Here^,1
I Belong To This Neighborhood I Am Well Known Here In South Africa^,1
A Quiet  Type Of Environment^,1
I Have Yet People There ^,1
The Scene Nature Of The  Community ^,1
Childhood Friends And Family Members Are There To Assist You^,1
Access To Social Amenities ^~Access To Economic Resources ^~Been Here All My Life^,1
It Is Where I Come From ^~My Family Lives There^,1
The Neighbourhood Is Peaceful^,1
I Think A It'S A Very Good Place For Retirement Less Crime.^,1
This  Is My Family  House ^,1
I'M Already Used To Be Here^,1
I Just Love The Place~ Nothing Much^,1
Because It'S Back Home Where The Respondent Belongs^,1
Don'T Know Where Would Retire To But Would Move Anywhere Where There Are Opportunities^,1
Life Is Better Than Here.^,1
The Environment Is Better Than Polokwane.^,1
My Parents Are From There^,1
At Least My Parents Have Property There^,1
It Is A Very Nice And Quiet Place ^~My Family Is There ^,1
I Am Not Gonna Move^,1
Everything Is Quick To Get Here^,1
I Will Be More Respected In My Home Community^,1
Isa Nice Placeto Do Farming^,1
Already Built A Home There ^,1
Better Government Services And Serene Environment^,1
Run Her Own Business In Texas^,1
Place Of A Retiment As For Me Should Be A Peaceful Place Like Home^,1
The Are Better Opportunities Here We'Re I Stay^,1
Peaceful And No Expenses ^,1
That Is Where I Call Home^,1
It Is A Developed And Peaceful Country^,1
I Feel Established Here^,1
I Hope To Build My House There^,1
My Home And Country^,1
For Economic Gain^,1
Due To The Serene Nature Of The  Place^,1
Access To Education In English For My Children^,1
For My Peace^,1
There'S No Place Like Home^,1
I Belong Here^,1
Husband Has A Plot There^,1
Go Back Home To My Roots^,1
Close To Church ^,1
It'S Were I Feel Is A Nice Place And Most Business People Relocate There^,1
I'M Used To The Life Of This Place^,1
She Will Get Married ^,1
Don'T Know Where Would Retire To^,1
Home Is Always The Best More So On Retirement. ^,1
Lige At Nairobi Is Becoming And It Is Easy To Invest There^,1
There'S Lots Of Crime Here^,1
It Is Peaceful And There Are No Expenses ^,1
Don'T  Know Where  I Will Be^,1
Rwanda Is Home^,1
Peacefully ^,1
The County Is Growing Fast Hence More Opportunities To Invest^,1
Because It Is Where I Was Born. My Place Of Origin ^,1
It'S My Home ^,1
I Have No Plans To Live Anywhere ^,1
The Smell Of Fresh And There Is Peace There^,1
It'S Where I Come From ^,1
I Came Here To Make Money For My Kids~And M Aren'T Are Back Home^,1
Quite Neighbourhood^,1
This Is Where I Was Born And I Have Also Made My Family Here^,1
Access To Education ^,1
I Like It Here~ I Feel Like I Belong^,1
Kenya Is Safe And I Have Had A Great Time ^,1
My Children Are Here^,1
Such Country Have Good Police For Retirees ^,1
My Family Stays There^,1
That Is Where I Want To Build My Future House^,1
Community Togetherness^,1
It'S A Middle Class Neighbourhood.^,1
Lots Of Opportunities Here^,1
It Is Close To My Hometown. Traveling Back Home Will Be Easier^,1
Stay With My Mother ^,1
Famiy Members Reside There And Can Be Of Help Anytime ^,1
Husband Bought Land There^,1
I Will Be With My Family ^,1
It'S My Home^,1
Home Is Where My Placenta Was Buried And I Must Retire There. ^,1
I Feel I B I Have My Family Hereenglish^,1
The Quiet  And Neat Environment ^,1
Closeness To Hometown ^~Plan To Acquire Property There^,1
That Was Where I Was Born ^,1
A Very Cool And Calm Environment^,1
Due To The  Peaceful Nature Of The Place ^,1
Most Of My Extended Family Have Moved Here So I Know Many People Here^,1
It Is A More Peaceful Place ^~My Family Will Be There^~It Is More Developed ^,1
I Feel Comfortable Here In Ghana^,1
Because  It'S My Place  Of Birth^,1
This My Husband Family House ^,1
Its My Home Town^,1
Access To Place Of Birth^~Access To Extended Family ^,1
Due To Serene Nature Of The Place ^,1
It Is Developed ^~I Don'T Want To Suffer In My Old Age^~I Need A Clean And Organised Environment ^,1
No Reason Because I Was Born There^,1
I Have Property And Land There^,1
My Ancestral Home^,1
Home Sweet Home^,1
Marital Home^,1
It'S Close To My Village^,1
Access To Serene Environment ^~Access To Rich People^,1
My Hometown ^,1
My Children And Mother Are There^~It Is My Home Town And I Would Be Among My Family ^,1
More People Speak Hausa There^,1
This Is Where My Family Are Here^,1
Access To Higher Wage^,1
Have My Family Here (Children)^,1
That Place Is More Decent And Ghana In General Is More Peaceful Than Nigeria^,1
I Feel Okay Here^,1
Have A Plot Of Land There~ Which Very Soon I Will Build On It And One Day Move To Settle In There. ^,1
Because Of My Extended Family ^,1
Head And Direct Family Issues^,1
I Have My House There And The Place Is Cool^,1
Access To Family Live^,1
That Is Where I Can Afford To Buy Land To Build Or Rent A More Decent House^,1
It'S Close To Accra And Relatively Neat. I'M Also Building My House There^,1
My Children Are There And I Am Not Ready To Bring Them Here^,1
Housing Is Affordable ^,1
My Home Town ^,1
Because Life Is Better Here Than At My Place Of Origin^,1
I Will Be Next To My Children^,1
Is My Origin I Like To Be Laid To Rest In My Country^,1
Hlabisa Kzn Is My Origin  And Is Peaceful And Safe^,1
Because I Belong To This Neighborhood And Is My Origin^,1
Place Is Peaceful ^,1
Serene And More Space.^,1
Because It'S My Home Country^,1
Be With Family ^,1
It Is A Developing Area With Lots Of Opportunities ^,1
My Family Is There And Will Support Me Physically And Emotionally ^,1
Will Retire Here In This Place Because It'S Where I Belong^,1
It'S Where The Respondent Belongs And Would Like To Retire There^,1
Harare^,1
The Place Is Appealing To Me And It'S My Home Town^,1
I Want To Be Close To My Children^,1
Is My Home Place ^,1
I Don'T Really Know Anywhere Else That I Would Like^,1
No Expenses ^,1
I Will Build A House Here ^,1
Nice Place^,1
Nice Place To Stay^,1
Return To My Roots^,1
Its Well Planned And  Clean^~Its A Serene Community ^,1
This Where I Have My Investments And That'S My Life.^,1
Have Dual Citizenship^,1
Home~ Where He Belongs (Katlehong)^,1
Family Members Are There^,1
Life Is Advanced And Good There^,1
Here In South Africa Therecis Too Much Crime~I Came For Making Money And Going Back Home^,1
The Place Is So Cool And Freely Will Make Me Have Good And Peaceful Mind When Resting As Compared To Here In The City^,1
I Grew Up That And Know A Lot Of Friends And Family ^,1
It'S Home To Me~ A Person Will Always Go To Their Home Town^,1
Is My Home Country And Most Of My Family Members Stays There^,1
I Don'T Want To Die In A Foreign Land^,1
Looks Good From The Books ^,1
I Love The Atmosphere And The Neighborhood^,1
